{
  "_id": "sha256:4d1f0a7e2b9c8d3e6f5a4b3c2d1e0f9a8b7c6d5e4f3a2b1c0d9e8f7a6b5c4d3e",
  "schema_version": 1,
  "scene_set_version": "sha256:37c9ff2cbfb0890ef9c3f4963b1dbcb109d2f8f65a50db3a043cee8c76cbe7e1",
  "asset_version": "sha256:9f86d081884c7d659a2feaa0c55ad015a3bf4f1b2b0b822cd15d6c15b0f00a08",
  "scene_index": 0,
  "enricher": "transcript",
  "classification": "internal",
  "model": {
    "name": "small",
    "digest": "sha256:0c7e9d2a4b6f8e1d3c5a7b9f0e2d4c6a8b0f1e3d5c7a9b1d3f5e7a9c1b3d5f7e"
  },
  "segments": [
    {
      "start_seconds": 0.42,
      "end_seconds": 6.18,
      "text": "Welcome back. Today we look at how the pipeline cuts a video into scenes.",
      "language": "en",
      "confidence": 0.91
    },
    {
      "start_seconds": 6.9,
      "end_seconds": 13.347,
      "text": "Each scene gets its keyframes and an audio clip of its own.",
      "language": "en",
      "confidence": 0.88
    }
  ],
  "created_at": "2026-10-28T10:00:00Z",
  "lineage": {
    "step": "enrichment",
    "fingerprint": "e41a9c27b0d5",
    "inputs": [
      "scene-set:sha256:37c9ff2cbfb0890ef9c3f4963b1dbcb109d2f8f65a50db3a043cee8c76cbe7e1",
      "derivative:sha256:f55ff16f66f43360266b95db6f8fec01d76031054306ae4a4b380598f6cfd114"
    ],
    "version": "sha256:4d1f0a7e2b9c8d3e6f5a4b3c2d1e0f9a8b7c6d5e4f3a2b1c0d9e8f7a6b5c4d3e",
    "image": null
  }
}
